Relevant,Type,,Sentence
,,,it was then taken over by clarence brown.
,,,"the block was sold to the following people in the proper sequence: ethel & arvid holmquist, paul hoyle, laurice goodwin, joseph & history of monson, maine 39 james quartararo and the present owners, c. leavitt and james quartararo."
,,,(rent upstairs.)
,,,"monson light and power building - in 1889, c. w. folsom had a drug store on one side of theï¿½ï¿½ building, and a post office was on the other s"
,,,roy hescock had the drugstore - post office when the buildï¿½ï¿½ ing burned in the 1910 ï¿
,,,"in 1912, it was rebuilt by alner gilbert."
,,,"since that time it has been used as a variety store, a&p store, grocery store and post office."
,,,the annex was used as a garage.
,,,it is now owned by francis g. marshall as an office and storage.
,,,rents upstairs - vacant.
,,,"pooleï¿½ï¿½ï¿½s market - former owners - ladd, w. a. bray, arthur bray, n"
,,,oswald poole bought it from nadeau.
,,,it has always been a grocery store.
,,,it was damï¿½ï¿½ aged by ï¿½ï¿½ï¿½re in 1955 when nadeau
,,,rent in back was gutted by the ï¿½ï¿½ï¿½re and was re
,,,rent upstairs ï¿½ï¿½ vac
,,,masonic block - burned in 1911. arthur brown had a store on the street level and a house owned by him was located out back of the masonic hall.
,,,a stable was underneath which also burned.
,,,rebuilt.
,,,the first ï¿½ï¿½ï¿½oor housed two busin
,,,"one side was a hardware store with the following proprietors: bill eldridge, george pulï¿½ï¿½ len, and gordon h"
,,,"the other side has been used as a restaurant, office and dress shop."
,,,"second ï¿½ï¿½ï¿½oor - banquet room, dentist and doctorï¿½ï¿½ï¿½s offices, barber and beauty shops and"
,,,"third ï¿½ï¿½ï¿½oor - the main hall was used by the masons, odd fellows, rebekahs and"
,,,"the building was damaged by ï¿½ï¿½ï¿½re july 12, 1969, and is now v"
,,,the present owner of the building is edward adams.
,,,monson variety store - the ï¿½ï¿½ï¿½re of 1911 started in this bui
,,,at this time sam hughes had a clothing store and barber shop housed here.
,,,the rent upstairs was occupied by storer flint who died in the ï¿½ï¿½
,,,"a 40 history of monson, maine bowling alley was in operation in the basement."
,,,the building was rebuilt by henry grover for edward johnï¿½ï¿½ son and was used as a grocery store then a post off
,,,rent upstairs remodeled.
,,,purchased by evold jorgensen about 1944-45 and is now owned and run by madeline j orgensen.
,,,"terris moore block - alner gilbert sold the building, which presently houses the post office and coffee shoppe restaurant, to roy hescock after the 1910 ï¿½ï¿½"
,,,r. hescock had a drugstore and post office thereï¿½ï¿½ which burned in 1911. r. hescock rebuilt
,,,"the same spot, and housed a drug store on one side with a barber shop on the other side of the building."
,,,hescock then sold it to aubrey williams who ran a drugstore with a post office in operation on the other side at that time.
,,,"the building is presently owned by terris moore, who lives in the upstairs apartment."
,,,blue goose - owned and operated by joe daviï¿½ï¿½ son as undertaking par
,,,burned in 1911 - rebuilt and used as undertaking parlor.
,,,it was then used as a feed store by guy hammond - danny guilds then had an antique store called the blue goose.
,,,it now belongs to edward adams who uses it for storage.
,,,vainio building - this building belonged to jesse rogers then harry daw.
,,,h. daw had a grocery store.
,,,rent upstairs.
,,,this building burned in the 1911 ï¿½ï¿½
,,,rebuilt.
,,,after daw died harry hughes had a groï¿½ï¿½ cery store - then austin robinson ï¿½ï¿½ï¿½grocery - sto
,,,galen vainio now owns the building which he bought in december 1969 and is his residence.
,,,donald keene building - built after 1897 ï¿½ï¿½
,,,"owned by orrin rice, and used as a barber shop and dwelling."
,,,"then sold to d. keene who had a barber shop one side of the building with a bakery, that now houses history of monson, maine 41 dr."
,,,isaac nelsonï¿½ï¿½ï¿½s office on the other
,,,rent upstairs ï¿½ï¿½ï¿½ v
,,,(note: the telephone office was once housed here when operators were employed.)
,,,monson laundramat - this building belonged to coombs & johnson between 1883 and 1885 and it burned in 1897. henry grover owned it about 60 years.
,,,ago and used it as a country store.
,,,"h. groverï¿½ï¿½ï¿½s son, merton grover then ran a bakery and later opened a s"
,,,louise grover sold to humphrey in 1963. humphï¿½ï¿½ rey in turn sold out to laurice goodwin who is the present ow
,,,rent upstairs.
,,,knights store - 1888 bought by p. w. knight from c. s. pullen & co.
,,,and was known as p. w. knight & sons (amos & henry).
,,,it was always used as a dry goods and clothing store.
,,,rent upstairs is presently occupied by katherine knight.
,,,store is closed.
,,,town hall (gar building) - first building built after the civil war.
,,,"destroyed in the ï¿½ï¿½ï¿½re of decemï¿½ï¿½ ber 28, 1888"
,,,the annex built in the 1930ï¿½ï¿½ï¿½s by 
,,,men.
,,,the gar turned the building over to the town of monson in the early 1940ï¿½ï¿
,,,"when the town owned it they housed the town office, fire dept."
,,,and public library on the ï¿½ï¿½ï¿½rst ï
,,,second ï¿½ï¿½ï¿½oor - was used for many activ
,,,"in 1972, the town deeded it to the: tisbury manor chapter d.a.r."
,,,and it presently houses monsonï¿½ï¿½ï¿½s historical m
,,,(note: in 1889 the town meeting hall was located in [tarr] spencerï¿½ï¿½ï¿½s 
,,,waymouthï¿½ï¿½ï¿½s garage - located on road to green
,,,built by dennis weeks for arthur day in the late 1920ï¿½ï¿
,,,arthur day owned and operated it until 1942. closed from 1942-45. reopened by a. day and run for a short time then sold to earl waymouth in late 1940ï¿½ï¿½ï¿½s who operated it as a g
,,,business closed by waymouth in 1971.
,,,"42 history of monson, maine daigle & daigle - built by patrick and jerry daigle."
,,,opened in the summer of 1970. hardware and lumber goods.
,,,located on rt.
,,,15. monson spring water co.
,,,#NAME?
,,,will bray bought the water company from percy smith on dec.
,,,"4, 1925. w. bray then to maude bray on oct."
,,,"8, 1945. m. bray in turn sold it to elwin & marguerite french on oct."
,,,"25, 1948. on april 8, 1955, e. french sold his half to esmond richï¿½ï¿½ ard"
,,,"e. richardson & m. french sold out to thaxter jones on june 20, 1962. in july of 1968 a town meeting was held and it was voted to buy the water company for $6,000."
,,,on oct.
,,,"1, 1968, the town of monson took over the water co."
,,,from thaxter jones.
,,,the town owns the company at the present time.
,,,c. v.
,,,"(tad) turner, inc."
,,,#NAME?
,,,located on the william hughes farm on the willimantic road.
,,,insurance: francis g. marshal ï¿½ï¿½ï¿½hartford insuran
,,,and monson light and power co.
,,,robert e. lander --general insurance stanley a. robinson - insurance and real estate broker forest products: merton carr - woods operator bjork bros.
,,,ýýýwilliam and harlan - woods operators robert brown - pulp buyer wayne reed - pulp and logs hollis nelson ýýýwoods operator lloyd kelley - building camp roads and backhoe work kelley bros.
,,,"ýýýapple orchards c. v. tad turner - forest products and contractor history of monson, maine 43 beauticians: me meýýýs beauty salon - amelia daigle, prop."
,,,"jo lï¿½ï¿½ï¿½s toppe knott shop - joyce lander,"
,,,"miscellaneous: phyllis ruksznis - bakery raymond anderson - painter (buildings) berwin storer - painter (buildings) dennis casey ~ ï¿½ï¿½ï¿½wildwood camp groundï¿½ï¿½ï¿½ monson pond herbert bishop - snowmobile dealer - bishopï¿½ï¿½ï¿½s great outï¿½ï¿½ doors joyce kelley - antiques brown's nursing home -"
,,,frenchï¿½ï¿½ï¿½s boarding home - marguerite french robert l. greenleaf - electrician robert leavitt - electric motors olive hammond - seamstress leon piela - carpenter lawrence hammond - bookkeeper william erickson - crawlers (bait) earl waymouth - live bait ed and audrey higgins - live bait kendrick benton - photographer gerry weymouth ï¿½ï¿½ï¿½artist and teacher elinor brayton -
,,,"elizabeth seitz - the shell studio coffee shoppe kahvila - helen johnson, prop."
,,,"bessie doble - antiques patrick & jerry daigle - carpenters edna haggstrom - knits and crochets articles for sale harry lindie - radio repair f. elwin french - repair shop and makes novelties two active farms: john sandberg - southeast monson forrest stevens - (old steward farm) southeast monson 44 history of monson, maine history of monson, maine 45 ."
,,,_ aim .
,,,"ýý~' ' ..ýý:ýýýýýýýýxýýsýýý kineo quarry (abandoned) building now used as town sand shed 46 history of monson, maine portland-monson slate co."
,,,1910-12 portland-monson slate co.
,,,"1972 history of monson, maine 47 9-431;ï¿½ï¿½ï¿½yï¿½ï¿½ï"
,,,"ýýý#3ýýý monson, maine slate co."
,,,"(old photo) moosehead manufacturing company - 1972 formerly the monson, maine slate co."
,,,"48 history of monson, maine products manufactured by moosehead mfg."
,,,co.
,,,kennedy marker came from portland-monson slate co.
,,,"history of monson, maine 49 m. r. r. no."
,,,3 engine at monson station on water street m. r. r. no.
,,,"4 engine - engineers: albion johnson & elwin french 50 history of monson, maine cï¿½ï¿½ï¿½hampionï¿½ï¿½ï¿½s filling station - now yankee trader built in 1935 monson garage in 1923 arthur haggstrom and archie greenleaf present owner - j. ruksznis history of monson, maine 51 main street looking south (o"
,,,#NAME?
,,,"adams, former a. andersonï¿½ï¿½ï¿½s, d. keene, laundramat, and knigh"
,,,"main street looking north (old photo) 52 history of monson, maine main street looking south (0121photo) j."
,,,"8; j. general store, manson light & powcr co, masonic block, etc."
,,,"pooleï¿½ï¿½ï¿½s market history of monson, maine 53 g.a r. hall - taken before former american legion hall annex built in 1930. with civil defense "
,,,taken in early 1940ï¿½ï¿
,,,present storerï¿½ï¿½ï¿½s home care c
,,,"g. a. r. hall, then town hall, present d. a. r. building."
,,,"54 history of monson, maine 1972 ï¿½ï¿½ï¿½main street looking north 1972 ï¿½ï¿½ï¿½main street looking south history of monson, maine 55 new municipal building on february 14, 1968, the town approved an earlier proposal of building a new municipal building to house the monson town office, library, fire department, h"
,,,and youth activities room.
,,,ground was broken in april of 1968 for the new building which was designed by dan edgerton at the site of the former willer hotel.
,,,"the cost of the new building was $39,200."
,,,"on june 16, 1969, open house was held dedicating the new addition to t.he town."
,,,"fire department history prior to the organization of the monson volunteer fire department, the town had no ï¿½ï¿½ï¿½re ï¿½ï¿½ï¿½ghting equipï¿½ï¿½ ment and depended on the help of "
,,,"in 1877, alvin gray, who was the selectman, bought ï¿½ï¿½ï¿½an engine, and an old hand tub and some hose for $400 which the town appropriated for tha"
,,,at that time much was said against the purchase until the ï¿½ï¿½ï¿½re of 1897 which burned the buildings from the canal to knightï¿½ï¿
,,,this section was rebuilt as follows from knightï¿½ï¿½ï¿½s store to the canal - groverï¿½ï¿½ï¿½s now the laundramat owned by laurice goodwin - orrin rice - now donald keene block - e. mclver ï¿½ï¿½ï¿½last known as arvid andersonï¿½ï¿½ï¿½s store which was demolished in 1966 - j. davison - now edward ada
,,,"the ï¿½ï¿½ï¿½rst ï¿½ï¿½ï¿½re apparatus is now in a museum in meredith, ne"
,,,"the monson fire department was organized in 1937, with dennis weeks as chief, and sixteen members who were arthur day, merton grover, clair sargent, stanley stevens, cliff simpson, henry knight, erick erickson, arthur haggstrom, fred berry, anselm swanson, paul jackson, guy hammond, thomas mountain, elwin french, robert benton and eugene bickford."
,,,"56 history of monson, maine the first ï¿½ï¿½ï¿½re house was in the old gar hall known as the old town hall on main street and remained there until 1968 when the new municipal building was "
,,,"in 1937, the ï¿½ï¿½ï¿½rst motor driven ï¿½ï¿½ï¿½re engine was purï¿½ï¿½ chased which is still b"
,,,"the department presently has two ï¿½ï¿½ï¿½re engines, two tank trucks and an army surplus "
,,,an alarm system was installed on the top of the old town hall building.
,,,prior to this the church bells were used as a means of an alarm.
,,,"on may 3, 1946, arthur haggstrom became fire chief, a post heï¿½ï¿½ held until march 28, 1961, when john ruksznis became chief and who holds this office at the present t"
,,,the ï¿½ï¿½ï¿½re department now consists of 20 men who attend regular meetings and training ses
,,,monson has been the victim of many ï¿½ï¿½ï¿½res over the 
,,,"in may, 1824, a ï¿½ï¿½ï¿½re which started on what is now the common, where the forest was being cleared away, threatened to destroy what buildings there were in the vic"
,,,"all the help that could be found worked hard for a day and night to save the mills, two houses and one or two outbuildings then standing where the village; is now."
,,,then another ï¿½ï¿½ï¿½re struck the town in the autumn of 1825. this ï¿½ï¿½ï¿½re swept across a large portion of this state destroying great tracts of 
,,,"many of the buildï¿½ï¿½ ings were in danger, but through strenuous efforts, none were destro"
,,,"again in the spring of 1831, the village was threatï¿½ï¿½ ened once m"
,,,the great fire (taken from the 1914 pharetra) it is quite a look backward over the nearly ï¿½ï¿½ï¿½fty-four years since the great ï¿½ï¿½ï¿½r
,,,"within this period monson has been visited by a number of serious conï¿½ï¿½ï¿½aï¿½ï¿½ grations but none of them has destroyed so large a history of monson, maine 57 proportion of the buildings as that on may 27, 1860, which swept away most of th"
,,,"few who were then of adult age are now living, and those who were: then chidren are well along in years."
,,,"prior to 1860, monson enjoyed a remarkable exï¿½ï¿½ emption from serious ï¿½"
,,,"the town in common with others suffered from the great forest ï¿½ï¿½ï¿½res of 1825, but from 1818 to 1860, according to reverend charles daviï¿½ï¿½ sonï¿½ï¿½ï¿½s semiï¿½ï¿½ï¿½centennialaddress, only four dwelling houses had been destroyed by ï¿½ï¿½ï¿½re; namely, that of samuel rowe in the winter of 1818-19, that of calvin colton in the spring of 1823, that of george doughty in 1836 and that of alexander greenwood houston in november, 1852. for seven years after this last ï¿½ï¿½ï¿½re the sound of "
,,,"its silence was ï¿½ï¿½ï¿½rst broken march 31, 1860, when the academy burned, to be folï¿½ï¿½ lowed by a greater conï¿½ï¿½ï¿½agration not quite t"
,,,"in may, 1860, the weather had been for several weeks warm and dry."
,,,there were no slated roofs in monson then and the shingles on the roofs were dry as tinder.
,,,"sunday, may 27, was a calm and pleasant day with a light south wind."
,,,shortly after the close of the morning services the sabbath stillness was broken by the wild cry of ï¿½ï¿½ï¿½fireï¿½ï¿½ï¿½ and the ringing of the bell in the congregati
,,,"looking across the little pond from the window of my fatherï¿½ï¿½ï¿½s house, then standing on the site now occupied by i. p. wingï¿½ï¿½ï¿½s residence (now the home of edwin holmï¿½ï¿½ bomï¿½ï¿½ï¿½s), i saw the ï¿½ï¿½ï¿½ames pouring from the roof of theï¿½ï¿½ stable connected with nelson savageï¿½ï¿½ï¿½s hotel called the ï¿½ï¿½ï¿½mansion houseï¿½ï¿½ï¿½, the hotel being on the site now occuï¿½ï¿½ pied by peleg w. knightï¿½ï"
,,,"in the few minutes required to reach the spot, the ï¿½ï¿½ï¿½ames had spread to the hotel and the inmates were throwing, out of doors and windows, 58 history of monson, maine beds, bedding and furniture in frantic effort to save something from the "
,,,the heat generated an active air current and the ï¿½ï¿½ï¿½ames with a wild roar devoured everything they touched in an incredibly short
,,,"the burnin.g shingles were swept high in the air and were carried by the now accelerated south wind northward, immediately setting ï¿½ï¿½ï¿½re to any roof on which they dr"
,,,the ï¿½ï¿½ï¿½ames mocked the puny efforts to stay their onward rush with water pails and buckets - the only ï¿½ï¿½ï¿½re-ï¿½ï¿½ï¿½ghting apparat
,,,it was a spectacle at once grand and awful to see almost the entire village in ï¿½ï¿½ï¿½ames at
,,,the ï¿½ï¿½ï¿½re began about one p. m. or a little earlier and by three p. m. the work of destruction was substantially com
,,,"when the sun set on that eventful day, little was left in the central part of the village but a mass of smoking ruins."
,,,"except a small shop next north of the canal, every building on the west side of main street from the manï¿½ï¿½ sion hotel north was destro"
,,,this included tarrï¿½ï¿½ï¿½s and knightï¿½ï¿½ï¿½s black
,,,"tenneyï¿½ï¿½ï¿½s wheelwright shop, j. h. pullenï¿½ï¿½ï¿½s store and hom""ward on the lot afterwards of a. s. garland (now gordon hal1ï¿½ï¿½ï¿½s "
,,,"the ï¿½ï¿½ï¿½re also destroyed a cabinet shop of elias t. andrews and dwelling of albion jackson, both on pleasant street the latter on the site o"
,,,hattie craftsï¿½ï¿½ï¿½ residence (now known as esther penningtonï¿½ï¿
,,,only a change of wind prevented the ï¿½ï¿½ï¿
,,,from sweeping up church street.
,,,"on the east side of main street every building north of the canal to and including the congregational church was burned, in cluding aretas chapinï¿½ï¿½ï¿½s extensive"
,,,"buildings, oliver evelethï¿½ï¿½ï¿½s store (now erma smal1ï¿½ï¿½ï¿½s home) and dwelling occupied by a. g. houston (former d. a. r. chapter house) and the hotel called the ï¿½ï¿½ï¿½monson houseï¿½ï¿½ï¿½ (located in the general area of berwin storerï¿½ï¿½ï¿½s home) the"
,,,"(note: aretas history of monson, maine 59 chapinï¿½ï¿½ï¿½s farm was about where louise groverï¿½ï¿½ï¿½s home "
,,,"in the midst of the excitement a dwelling house on central street formerly occupied by honorable j. h. rice on the lot afterwards of a. f. jackson (now the home of edward laverty which was formerly owned by ansel lapointe), caught ï¿½ï¿½ï¿½re from the ï¿½ï¿½ï¿½ying embers and was speedily burned to"
,,,"in the space of two hours, about forty buildings were totally destroyed with a large portion of their contents."
,,,so rapidly did theï¿½ï¿½ ï¿½ï¿½ï¿½ames spread that there was little opportunit
,,,anything.
,,,"the buildings destroyed included one church, two hotels, three of the four stores, six dwellings beï¿½ï¿½ sides shops, one law office, barns and outbuildi"
,,,the business part of the village was practically wiped out.
,,,some of the sufferers were stripped of substantially all their earthly possessions.
,,,some had no insurance and others while less unfortunate never recovered from their losses.
,,,"to crown all, certain disreputable characters from outside added plunder to the troubles of the sufï¿½ï¿½ fer"
,,,"the total losses were estimated at $22,750 and inï¿½ï¿½ surance only $9,"
,,,at the scale of prices prevailing this meant much more than the same figures would represent today and gives a very imperfect idea of the magnitude of the misfortune which for the moment overï¿½ï¿½ whelmed the little vill
,,,"the heaviest losers were nelson savage, $1,300; j. h. pullen, $2,800; congregaï¿½ï¿½ tional society, $1,200; with no insurance; solomon j. chandler, $3,000; oliver eveleth, $2,200; and aretas chapin, $8,"
,,,"the figures are those given in the obï¿½ï¿½ server at the time, and those losses except in the case of the church were partially covered by insura"
,,,the business men sought such accomodations as they could ï¿½ï¿½
,,,"the post office was for some time kept in the rear wing of horace flandersï¿½ï¿½ï¿½ house (now tolford 60 history of monson, maine durham"
,,,some who had been in business at monson sought other ï¿½ï¿½ï¿½elds of act
,,,it was many years before the village regained its former prosperity.
,,,the cause of the ï¿½ï¿½ï¿½re was never certainly 
,,,one rumor attributed it to certain half intoxicated perï¿½ï¿½ sons smoking in the hay loft of nelson savageï¿½ï¿½ï¿
,,,others believed that the ï¿½ï¿½ï¿½re was deliberately set by an offender who had been arrested in monson shortly before and who threatened vengeance upon the
,,,"no attempt was made however (perhaps from lack of evidence) to bring the culprit, if such he was, to justice."
,,,incidentally the ï¿½ï¿½ï¿½re resulted in one important beneï¿½ï¿½ ï¿½ï¿½ï¿½t in ridding monson (let us hope forever) from hotels in which intoxicating liquor wa
,,,"shortly after the ï¿½ï¿½ï¿½re aretas chapin opened a hotel (built on the site of the now bartlettï¿½ï¿½ï¿½s gulf station), which until it burned on march 25, 1882, maintained a consistent and honorable record as a temperance hotel, and this excelï¿½ï¿½ lent record has, i believe been maintained by hotels since o"
,,,dudley p. bailey the alarm of ï¿½ï¿½ï¿½re rang at 4 
,,,"on friday the 28th of december of 1888. the engine house with the g.a.r hall above, the building owned by hilman bros."
,,,"and used as a furniture and tailorï¿½ï¿½ï¿½s shop, a"
,,,"boyntonï¿½ï¿½ï¿½s ï¿½ï¿½ï¿½ne new buildings, store and dwelling with barn adjoining and a dry house ï¿½ï¿½ï¿½lled with lumber belonging to the monï¿½ï¿"
,,,were swept away in an hourï¿½ï¿½ï¿½s
,,,it was the most disasterous ï¿½ï¿½ï¿½re since 1860. the town lost the road machine for which it paid $225.00 just two years b
,,,the buildings burnt nearly together and almost everything in them was destroyed.
,,,the hearse was saved.
,,,(note: this is the ï¿½ï¿½ï¿½re which burned from water street to the residence of alvin grayï¿½ï¿½ï
,,,"ýý~haggstromýýýs this event was taken from the private history of monson, maine 61 journal of miss sadie emerson, daughter of the rev."
,,,"emerson, and loaned by her grandson, vernon wilson."
,,,"january 12, 1897, everything was burned from the canal to p. w. knightï¿½ï¿½ï¿½s "
,,,later in 1899 the old hotel stable (situated where the bartlettï¿½ï¿½ï¿½s gulf station now stands) b
,,,"then on january 6, 1910, the lake hebron hotel which opened in 1882 was consumed by ï¿½ï¿½"
,,,in the winter of 1910 (dec.
,,,11) ï¿½ï¿½ï¿½re destroyed all the buildings from the bray block (now poo1eï¿½ï¿½ï¿½smarket) to the corner of pleasant and 
,,,fire broke out on the night of nov.
,,,"9, 1911, in the business section and swept everything from the spencer block (former a. anderson block - now a vacant lot) to w. a. brayï¿½ï¿½ï¿½s store (now known as pooleï¿½ï¿½ï¿½s market) including the m"
,,,during the night of nov.
,,,"3, 1919, there was a bad ï¿½ï¿½ï¿½re in one of the railroad buildings, which destroyed all the engines belonging to the road, leaving us now without any rail se"
,,,(taken from alvin grayï¿½ï¿½ï¿½s d
,,,"(note: damaged engines, no."
,,,"3 and 4, repaired by d."
,,,weeks.)
,,,on nov.
,,,"5, 1939, there was a ï¿½ï¿½ï¿½re at clarence brownï¿½ï¿½ï¿½s store (now known as j & j general store) which damï¿½ï¿½ ag"
,,,"if one should ask some of the older citizens in monson what the longest night theyï¿½ï¿½ï¿½ve ever had, they might recall the ï¿½ï¿½ï¿½re on december 17, 1942, when the ï¿½ï¿½ï¿½re started in the crating room of th"
,,,slate co.
,,,"from 8 :30 to 10 p. m., they fought hard to save: the building which they did quite successfully."
,,,then one.
,,,"hour later, ï¿½ï¿½ï¿½re was discovered in the big mill which lasted until 8 o'clock the next mo"
,,,"a ï¿½ï¿½ï¿½re always ends up as a loss for someone, but perhaps one of the most tragic losses was on march 2, 1950, when elwood smith, his six children and his mother harriet smith were burned to "
,,,his wife was badly burned and hospitalized.
,,,"their house was situated beï¿½ï¿½ 62 history of monson, maine tween what is now a. swansonï¿½ï¿½ï¿½s and a. smal1ï¿½ï¿½ï¿½s o"
,,,(the latter sold to e. casey).
,,,the smith house was the oldest house in town at that time and was onceï¿½ï¿½ located where brown's nursing home now sta
,,,on feb.
,,,"7, 1955, pooleï¿½ï¿½ï¿½s market, then owned by nadeau, was damaged inside by "
,,,"the interior of the masonic hall which housed pulï¿½ï¿½ lenï¿½ï¿½ï¿½s hardware and robinson insurance agency on the ï¿½ï¿½ï¿½rst ï¿½ï¿½ï¿½oor, burned july 12, 1969. organizations am"
,,,116 and auxiliary towneï¿½ï¿½ï¿½holmbom po
