Relevant,Type,,Sentence
,,,"john w. dana, and can be found in chapter 62 of the acts of that year."
,,,"the corporate name was ï¿½ï¿½ï¿½stockholders of monson academyï¿½ï¿½ï¿½, each subscriber holding a number of shares corresponding to his s"
,,,the corporators met for organization at ï¿½ï¿½ï¿½centre school houseï¿½ï¿½ï¿½ in mon
,,,"4, 1847. dr."
,,,"alpheus davison was chosen chairman and ephriam flint, clerk."
,,,on sept.
,,,"18, 1847 the following were chosen: lucius bradford, pres."
,,,#NAME?
,,,"- ephriam flint, clerk and aretus chapin, treas., with ï¿½ï¿½ï¿½fteen tru"
,,,"the building was erected by joseph lombard, for $935.51, the total cost including a heating system being $1,014.87."
,,,the building was dedicated aug.
,,,"28, 1848. history of monson, maine 21 the legislature granted the institution a half township, which was sold dec."
,,,"2, 1852, for $3,000.00."
,,,for several years the sum constituted the entire endowment of the academy.
,,,"the original building was two stories high measuring 37 by 40 feet with the school on the ground ï¿½ï¿½ï¿½oor and the hall above being used for a recreation room and for concerts, lectures and other public pur"
,,,"the academy had a small, well-selected library."
,,,the ï¿½ï¿½ï¿½rst session of school was held in the fall of 1848 with 106 persons in atten
,,,"march 1860, the academy was burned to the ground."
,,,"reconstruction was started immediately and the framework of this structure measuring 37 by 56 feet was still uncovered when ï¿½ï¿½ï¿½re again selected monson as its victim, destroying the greater part of the village.in spite of all obstacles the stalwart people of monson ï¿½ï¿½ï¿½nished building the academy in 1860. the 1861 legislature granted monson academy one fourth of a township in aroostook county, which the truste"
,,,"24, 1864, to george k. jewett of bangor, for $2,000.00."
,,,the inï¿½ï¿½ terior of the building was ï¿½ï¿½ï¿½nished on the strength of t
,,,"the ï¿½ï¿½ï¿½rst session of school was held in the new academy in 1861, and continued under the direction of the trustees until 1872, when the academy united with the high school in exchange for a grant made by the town for this pu"
,,,the academy was then governed by the trustees and the school committee.
,,,"on july 1, 1892, the ï¿½ï¿½ï¿½rst ï¿½ï¿½ï¿½oor of the academy was made into two school rooms and the high school was"
,,,"on january 2, 1901, the academy was made free for the students of monson village."
,,,"a on january 16, 1908, arrangements for a laboratory were made."
,,,"march 16, 1922, $100.00 was spent for installing electric lights for the academy."
,,,"1 22 history of monson, maine february 27, 1924, $3,000.00 was spent remodeling the academy."
,,,"the academy celebrated its one hundredth birthï¿½ï¿½ day in the summer of 1947. the same building was used with slight changes in remodeling the inside with up-to-date heating, lighting and plumbing facilities until 1968, when the academy consolidated with school administrative district"
,,,68. the academy and elementary buildings were remodeled to house the grades from kindergarten thru the sixth grade.
,,,the seventh thru twelfth grades travel by bus to dover-foxcroft to attend grammar school and foxcroft academy.
,,,a gymnasium was one of monsonï¿½ï¿½ï¿½s big needs for a great many 
,,,"in 1940 & 1941, the monson communï¿½ï¿½ ity hall fund was organized and a campaign was launchï¿½ï¿½ ed to raise "
,,,"by august of 1941, $4,600."
,,,"in cash and 50,000 feet of lumber had been donated."
,,,the plan was to have a wooden building with a slate roof.
,,,"when $10,000 was on hand the building would be started."
,,,"before the end of the year, vvorldwar ii disrupted all the plans."
,,,"a few donations continued to come in, and the local organizations and school classes continued to make annual contributions."
,,,all organized campaigns were suspended for the next ï¿½ï¿½ï¿½ve 
,,,"a monson academy alumni association was organï¿½ï¿½ ized in june of 1947. the ï¿½ï¿½ï¿½rst meeting for organization was held at the masonic hall june 13, 1947 with esther pennington acting as chairman of organization for the alumni as"
,,,at that meeting the following were chosen as officers: pres.
,,,- stanwood pullen; v.ï¿½ï¿½ï¿½pres.ï¿½ï¿½ harland joh
,,,#NAME?
,,,prior to this meeting the by-laws for the association were written by millard emanuelson as early as 1937. this group decided to back the gym project.
,,,"there was $16,000."
,,,"in the treasury, and the alumni association history of monson, maine 23 hoped to double the amount."
,,,the project was known as the monson gym fund from that time on.
,,,the steady rise in cost of materials and labor made the original type of building beyond reach.
,,,it was deï¿½ï¿½ cided to have a pre-fabricated type of aluminum build
,,,"the sum of $22,437.50 was needed to have an outlined building with foundation, walls and insulation."
,,,the structure was started and once more an appeal was made for subscriptions.
,,,"the response was generous, but there was only enough funds to carry on work for a few months."
,,,"at the town meeting on march 11, 1950, the town voted to borrow the sum of ten thousand dollars for the completion of the monson gym and the same to be paid back by the alumni association in ten notes, with each one being for a thousand dollars plus interest."
,,,the same year monthly committees were appointed to raise at least $100.00 a month.
,,,the enthusiasm with which these committees worked is a credit to any comï¿½ï¿½ mun
,,,"for five years there was a project every single month in this little town of less than one thousand persons and very seldom did a committee fail to raise the minimum, in many cases going way above the hundï¿½ï¿½ red dollar m"
,,,"in march, 1951, monson had the honor of having the late harland ladd, then state commissioner of educaï¿½ï¿½ tion, dedicate the new "
,,,"the last note on the gym was paid june 13, 1955, and the note burned with ï¿½ï¿½ï¿½tting ceremony at the alumni banquet june 24, 1955. at one time, the seventh and eighth grades sold refreshments at recess time under the supervision of the late pete gattrell, to earn money to add to the sum of two thousand dollars to buy stage curtains, chairs, bleachers, showers and other necess"
,,,"24 history of monson, maine history of monson, maine 25 north neighborhood school vinton distict school old burma school new burma school 26 history of monson, maine long district school monson academy and old grammar school present monson schools and gymnasium history of monson, maine 27 congregational church baptist church main street pleasant street swedish lutheran church swedish methodist church wilkins street water street 28 history of monson, maine rev."
,,,"douglas p. braydon monson community church main street community church parsonage on center street (former baptist parsonage) history of monson, maine 29 monsonï¿½ï¿½ï¿½s churches in may, 1820, a colony came from monson,"
,,,"these were men of character and inï¿½ï¿½ï¿½uence, men who had provided well for their families and who were deï¿½ï¿½ termined to maintain the same high standard in this new sparcely-set"
,,,"on their ï¿½ï¿½ï¿½rst sunday after their arrival, they had a meeting for religious worship in the house built "
,,,bearce.
,,,"as far as anyone can trace, this was the ï¿½ï¿½ï¿½rst service held in monson for the purpose of worship with the exception of two fun"
,,,arrangements were made to have religious services for the ï¿½ï¿½ï¿½rst sunday in june 
,,,"abiel pack:-u""dï¿½ï¿½ï¿½shouse, being more centrally located for monson people and for the families who had setï¿½ï¿½ tled at million acres, now "
,,,"the next sabbath, they met again at the same place and also organized a sabbath school."
,,,services were held here for the rest of the summer.
,,,for the next two years all worship services were held in the home of james stanchï¿½ï¿½ï
,,,"by this time a schoolhouse had been built in the center of the town, and public worship was held there until a church buildï¿½ï¿½ ing could be erec"
,,,"in august, 1821, rev."
,,,"john sawyer visited monson, and a congregational church was formed consisting of seven members."
,,,it was not until nov.
,,,"1824, that rev."
,,,lot ryder came to be the regular minister and was ordained in the barn of capt.
,,,s. whitney.
,,,"in 1831, the ï¿½ï¿½ï¿½rst church building north of bangor was erected and was dedicated as a congregational c"
,,,"this church, which was framed by r. k. packard, and was the ï¿½ï¿½ï¿½rst building framed by the square rule, was destroyed by ï¿½ï¿½ï¿½re in 1860, and rebuilt the fol"
,,,"august 10, 1827, marked the founding of the baptist church in monson, with 14 members."
,,,the meeting house.
,,,"30 history of monson, maine was erected in 1845. during the pastorate of the rev."
,,,"joseph grossa, (1918-1924) the church was remodeled, being raised two feet with a concrete sub-foundation and a back upper foundation."
,,,"a furnace, the gift of mrs."
,,,"brown steward, was installed in the basement and the old-fashioned pews were replaced by new ones."
,,,the old windows were replaced by lovely stained glass memoï¿½ï¿½ rial wind
,,,a vestibule was built onto the front of the building with one large entrance.
,,,the belfry and steeple were raised and the church was redecorated inside and out.
,,,"the baptist and congregational church began holdï¿½ï¿½ ing united services in 1933. church was held in the summer for six months in the baptist church, and in the congregational church in the winter of the remaining six months, with the "
,,,martin sorenson officiating.
,,,"after 10 years of planning the two churches (baptist and congregational churches) merged their buildings into one well-designed structure on august 14, 1959, to be called the monson community church."
,,,"in may, 1958, a building fund campaign was launched to ï¿½ï¿½ï¿½nance the joining of the two chu"
,,,"by late novemï¿½ï¿½ ber of that year the new foundation for the baptist church at the congregational church site on main street was completed and the church, minus its steeple, was on skids ready to be mo"
,,,"through donations and sales during the year, the move was possible in the spring of 1959. the rev."
,,,donald f. blanchette was pastor at the time.
,,,"the church members who helped to make the merï¿½ï¿½ ger possible were: george (bill) wentworth, record pullen, "
,,,"john durham, mr."
,,,and mrs.
,,,"philip knight, mrs."
,,,"clifton weymouth, miss vivienne bray, mrs."
,,,arvid anderson and mr.
,,,and mrs.
,,,sherwood johnson.
,,,"one year later, to the day, on august 14, 1960, the new sanctuary was dedicated."
,,,rev.
,,,"william r. huber history of monson, maine 31 was minister at the time of this dedication."
,,,the lights in the steeple were given in memory of samuel pennington by mrs.
,,,esther pennington.
,,,"on august 20, 1961, dr."
,,,charles gilky dedicated the pulpit in the sanctuary in memory of dr.
,,,shailer mathews.
,,,"in the summer of 1960, plans were made to make the congregational church building into an educational building with three classrooms, a lounge, and restroom downstairs with an auditorium upstairs."
,,,"$1,000.00 was left to the church by mrs."
,,,sarah huff.
,,,this money was the ï¿½ï¿½ï¿½starterï¿½ï¿½ï¿½ for the educational 
,,,"the committee borrowed $3,000.00 from the guilï¿½ï¿½ ford trust company and the carpenter,"
,,,"clarence case, started the work."
,,,"in march of 1961, the educational building was dedicated, and the united circle donated the lounge chairs to the church."
,,,"water and rest room facilities were installed in 1962. in 1963, the ï¿½ï¿½ï¿½nal payment on the $3,000.00 note was"
,,,"in the fall of 1966, the monson community church joined with the abbot and sangerville churches and formed the s.a.m."
,,,larger parish.
,,,"before this, the churches could not afford to hire a full time minister and relied on inexperienced students who could only stay for short periods of time."
,,,"after forming, they were able to hire rev."
,,,douglas brayton as full time minister devoting his time equally between the three churches.
,,,the s.a.m.
,,,"stands for sangerville, abbot and monson."
,,,"1971 brought the completion of the kitchen and dining room area, giving the various church and town organizations a place to hold their activities."
,,,"it was about 1874-1875, that the swedish people began coming to monson, most of them working in the slate quarries."
,,,the swedish people did not understand the language of this countr_v.
,,,"and wanting to worship 32 history of monson, maine god in their own tongue, they built a swedish 1viission church in 1890. some of the members of this church were lutheran, which is the state church of sweden, and some held other beliefs."
,,,"there was a break in the organization, and in 1892 the swedish methodist church was built."
,,,from that time on the swedish mission church was known as the swedish lutheran church.
,,,both churches had swedish ministers and conducted their serï¿½ï¿½ vices in their native ton
,,,there were services in these churches for many years.
,,,the saturday night church suppers which were held in the members homes were very popular.
,,,the swedish lutheran church on wilï¿½ï¿½ kins street was sold to the american legion in 1946 and made into a legion h
,,,on dec.
,,,"8, 1970 the american legion sold the hall, and it is now privately owned."
,,,"the swedish methodist church was sold to the assembly of god, which is the church located on water street, and is now known as the open-door full gospel church."
,,,"there were a few universalist people in town in 1884. a parish was organized, and a few services were held."
,,,"a ladies circle was organized, and a fund raised which was turned over to the universalist state convenï¿½ï¿½ tion, held in trust for universalist work in mon"
,,,the congregational parsonage was located between the homes of charles brown and robert greenleaf on s. main st.
,,,this building is now owned by d. luce.
,,,the following is a list of the church organizations: in-active active stella grace philathea youth fellowship baptist circle united circle congregational circle margaretï¿½ï¿½ï¿½listerphilathea entre nous club swedish mission ci
,,,"history of monson, maine 33 business history slate quarries: the summer of 1870 is a date that changed the patï¿½ï¿½ tern of living for the inhabitants of mon"
,,,"as william giffith jones was driving his horse along and gazing at the countryside, suddenly he saw slate."
,,,mr.
,,,"jones, having come from wales, knew slate and its commercial value."
,,,bill bought the land from a hotel keeper and started the development of the ï¿½ï¿½ï¿½rst slate quarry in monï¿½ï¿½ son within a
,,,"the first slate quarry was called the ï¿½ï¿½ï¿½eurekaï¿½ï¿½ï¿½ which means, ï¿½ï¿½ï¿½we"
,,,thus started the industry that was to be the main source of livelihood for monsonï¿½ï¿½ï¿½s inhabitants for many years to
,,,__ the next quarry to be opened was called ï¿½ï¿½ï¿½hebron po
,,,this was operated by a mr.
,,,chapin.
,,,a year afterï¿½ï¿½ wards it was sold to henry carter and the quarry was afterwards called ï¿½ï¿½ï¿½carter 
,,,"in 1872, the ï¿½ï¿½ï¿½norris quarryï¿½ï¿½ï¿½ opened and was opï¿½ï"
,,,norris.
,,,he was the ï¿½ï¿½ï¿½rst man to install steam 
,,,the buildings burned in 1877.
,,,1873 - fred jackson founded the cove quarry in which the machinery of the norris quarry was installed.
,,,also that same year the ï¿½ï¿½ï¿½dirigoï¿½ï¿½ï¿½ was opened and opï¿½ï¿½ erated by dexter and por
,,,1874 - forest quarry opened and operated by salem parties.
,,,1877 - oakland quarry opened and operated by john tripp.
,,,the monson-maine quarry was in operation in 1880 by allen williams and abandoned in 1943.
,,,1882 - kineo quarry - operated by outside parties.
,,,1882 ï¿½ï¿½ï¿½burmah q
,,,"34 history of monson, maine 1870-1875 ï¿½ï¿½ï¿½underground quarry - operated by charles f"
,,,1895 - ï¿½ï¿½ï¿½west monsonï¿½ï¿½ï¿½ ï¿½ï¿½ï¿½operat
,,,1902 - mathews quarry - operated by mr.
,,,mathews.
,,,1906 - portland-monson quarry.
,,,1910 - ï¿½ï¿½ï¿½farm quarryï¿½ï¿½ï¿½ and wil
,,,1919 - ï¿½ï¿½ï¿½eighteen quarryï¿½ï¿½ï¿½ - abandoned 
,,,"1922 - there were three quarries in operation - portï¿½ï¿½ land-monson, monson-maine slate"
,,,and the general slate co.
,,,"the coleman family, having the largest shares of stock, ran the portland-monson slate co."
,,,"until april 1, 1965, when it changed hands."
,,,itï¿½ï¿½ï¿½s now privately owned by the tatko f
,,,"monson slate is considered the ï¿½ï¿½ï¿½nest in the world and is particularly famous for its color, being "
,,,monson slate is shipped all over the united states and into many foreign countries.
,,,a couple of the more noted places it can be found is on the ï¿½ï¿½ï¿½ooring of the new monson town o
,,,"along with the black slate from monson, there is a mixture of green and red squares from new york and vermont quarries."
,,,"the ï¿½ï¿½ï¿½oor of the northeast bank of guilford, maine, also has added the beauty of monson slate to its f"
,,,monson slate was used as the kennedy memorial stones marking the resting places of the slain president john f. kennedy and two children at the arlington national cemetery.
,,,st.
,,,patrickï¿½ï¿½ï¿½s cathedral in new york city also has a slate roof made from monson 
,,,"monson railroad: in the early days transportation was by foot, horseï¿½ï¿½ back or a team of o"
,,,later came the stage from bangor to greenville.
,,,"in 1871, the railroad company of bangor hired a man to survey a road from guilford to greenville."
,,,"the road he surveyed would have run beï¿½ï¿½ history of monson, maine 35 tween the saw mill and the g."
,,,"hall (now monsonï¿½ï¿½ï¿½s historical museum), and through henry groverï¿½ï¿½ï¿½s orchï¿½ï¿½ ard (below where louise gr"
,,,but soon the people found out that the railroad company had sent a surveyor to survey a road following the piscataquis river from guilford to greenville via blanchard.
,,,with this misfortune the townspeople later felt that they needed some means of transportation.
,,,"in june, 1883, our little narrow gauge railroad, which was six miles long running from monson to monson jct., came into existï¿½ï¿½ a"
,,,"the equipment, which was original or close to it, consisted of two engines, one combination car, 28 ï¿½ï¿½ï¿½at and box cars, one snowplow and one spr"
,,,"it was ï¿½ï¿½ï¿½commonly known and called theï¿½ï¿½ï¿½twoï¿½ï¿½ï¿½by-sixï¿½ï¿½ï¿½, being two feet"
,,,it can be found in some reference books that the monson railroad was 8.16 miles long when itï¿½ï¿½ï¿½s only 6.16 miles from monson to monso
,,,"however, it was necessary to add the extra two miles of tracks going through to eighteen quarry which was beyond monson-maine quarry."
,,,"the ï¿½ï¿½ï¿½rst two engines number 1 and 2, 0-4-4-t were hinckleys and were built in 1882. the next two engines were numbered 3 and "
,,,3 0-4-4-t was built by the vulcan iron works in 1912 as was no.
,,,4 0-4-4-t which was built in 1918. the latter two were nearly identical except that no.
,,,3 had one stirrup to lift you up into the cab whereas no.
,,,4 had a double step.
,,,"the railroad was owned by the monson-maine slate co., and its primary purpose was to haul slate from the quarry to lv."
,,,[0nson jct.
,,,"it also carried passengers, mail and freight."
,,,"the ï¿½ï¿½ï¿½peanut roasterï¿½ï¿½ï¿½, as we fondly called the little train, never tu"
,,,she always backed the whole six miles from monson jct.
,,,to monson station.
,,,"the narrow gauge railroad was chartered in 1882, built in 1883 and abandoned in 1945. bus service was in existance in 1955 and ceased 36 history of monson, maine functioning in 1958, operated by haseyï¿½ï¿½ï¿½s bus "
,,,"the ï¿½ï¿½ï¿½rst store in town was opened in 1825, belongï¿½ï¿½ ing to olive"
,,,later that same year solomon cushman opened a store.
,,,"they remained the only two traders until 1830, when t. s. pullen from winthrop came to monson and started his own trade."
,,,from that time on monsonï¿½ï¿½ï¿½s businesses have continued to
,,,"after the ï¿½ï¿½ï¿½re of 186"
,,,"aretas chapin, son of one of the early settlers, constructed a hotel holding fast to all the principles of temperance."
,,,"this hotel was burned in 1882. in 1886, monson had a refrigerator and butter box factory."
,,,"the wooden boxes were lined with slate, the theory being that slate kept out heat and retained the cold."
,,,the project was not a success.
,,,moosehead mfg.
,,,"company: after the closing of the monson, maine slate co."
,,,"in 1943, a board of trade was formed by the merchants for the purpose of interesting an industry to locate in town."
,,,"in 1945, the moosehead vvoodcrafterï¿½ï¿½ï¿½s plant in greenville was destroyed by"
,,,it was rumored that they did not plan to rebuild in greenville.
,,,"the board of trade then met with the officials of the moosehead woodcrafters and they agreed to locate in monson for $50,000."
,,,the board of trade called a meeting of all interï¿½ï¿½ ested citizens and it was decided to ï¿½ï¿½ï¿½nance this venture by selling shares
,,,"the quarry buildings were purchased, remodeled, and work was begun at once."
,,,the woodcrafters made a wooden chair with a ï¿½ï¿½ï¿½seat and a back of we
,,,"the woodcrafters operated about a. year and a half and failed, leaving monson shareholders with nothing but worthless pieces of paper."
,,,"the spirit of the founders of monson showed in this generation, and a creditors committee was formed."
,,,"the stockholders history of monson, maine 37 raised twenty thousand dollars more and the plant operated for another six months, but could not keep going."
,,,the situation was really looking black when john.
,,,"durham of belfast, maine, became interested in the proï¿½ï¿½ j"
,,,mr.
,,,durham had formerly been employed by diamond match co.
,,,"for a number of years and as he says, his job was ï¿½ï¿½ï¿½putting sick factories onto their feet aga"
,,,the board of trade appealed to the stockholders and ten thousand dollars was offered to john and tolford durham to take over this ï¿½ï¿½ï¿½sick pla
,,,"the durhams invested heavily in the plant and put long, hard days trying to straighten out a very bad situation."
,,,john durham had to learn the furniture business from the bottom up.
,,,it was ï¿½ï¿½ï¿½nip and tuckï¿½ï¿½ï¿½ for the ï¿½ï¿½ï¿½rst three years; then things began
,,,"in 1954, the moosehead manufacturing company was able to pay a dividend to their stockholders."
,,,"on october 29, 1959, moosehead mfg."
,,,purchased an abandoned woolen mill in dover-foxcroft to extend the production of their beautiful furniture and opened for business in 1960. both plants today have roughly 200 employees.
,,,"the company has sales offices in new york city, los angeles, chicago, and san francisco with showï¿½ï¿½ rooms in new york and north carol"
,,,"tables and chairs are the monson plantï¿½ï¿½ï¿½s major production, while the dover-foxcroft plant manufacï¿½ï¿½ tures upholstered and bed room "
,,,"1972 monson businesses with their early history and former owners milton bartlettï¿½ï¿½ï¿½s gulf station - the land and buildings owned by french & curtis - they bought the land from arthur bessey in 1956. the ï¿½ï¿½ï¿½rst manager ï¿½ï¿½ john ruksznis followed by ronald clukey, maurice 38 history of monson, maine davis, frank templeton and in 1967, it was opened by its present operator - "
,,,yankee trader - the present building was built for daniel champion in 1935 by percy smith and was then known as championï¿½ï¿½ï¿½s filling st
,,,it was later acquired by arthur and edna c. haggstrom and in turn sold to alanson robbins in 1971. monson garage - the bottom story of the now john ruksznis home was previously located on main st.
,,,between a. haggstrom and d. williams houses.
,,,at that time the building which is now monson garage was a barn situated in back of this house.
,,,"after it was moved, it was used as a livery stable by p. w. knight and then as a leased garage."
,,,former business owners were: archieï¿½ï¿½ greenleaf and stanley stevens; archie greenleaf; danï¿½ï¿½ iel champion; will champion (operated by leslie robinson) ; edward dutra; lloyd butterï¿½ï¿½ï¿½eld; hal
,,,"the present owner, john ruksznis has been in business for 26 years."
,,,storerï¿½ï¿½ï¿½s home care center - this was a hardware store owned by billy eldridge and later by luther co
,,,"it was then bought by john strom, then by sam ulman and used as a meat store."
,,,the american.
,,,legion bought it from ulman and they in turn sold it to ira bishop.
,,,"next arnold grant owned it and he sold out to the present owner, berwin storer."
,,,(note: the civil defense had a lookout tower built on top of this building during world vvarii to report airplanes that passed the area.)
,,,j & j general store - attorney john spragueï¿½ï¿½ï¿½s house stood here before the 1910 
,,,it was rebuilt by arthur brown and made into a general store.
